[
  {
    "slug": "the-cranes-are-flying",
    "summary": "People call it \"formally astonishing and emotionally overwhelming,\" which gets to the point fast. It is a war drama, but the real hook is how alive and vulnerable it feels from moment to moment.",
    "appeal_tags": [
      "romantic devastation",
      "camera in motion",
      "war-time feeling"
    ],
    "good_pick_if": "You want something heartbreaking and visually electric rather than stoic or patriotic.",
    "maybe_skip_if": "You want a war movie with more distance or more action-forward momentum.",
    "confidence": "high",
    "source_quotes": [
      {
        "text": "formally astonishing and emotionally overwhelming",
        "source": "Letterboxd reviews page",
        "url": "https://letterboxd.com/film/the-cranes-are-flying/reviews/"
      }
    ]
  },
  {
    "slug": "apocalypse-now",
    "summary": "The appeal is that it feels \"totally immersive\" in a way few epics do. It is huge, hallucinatory, and less about military spectacle than about drifting deeper into a feverish, genuinely unnerving mood.",
    "appeal_tags": [
      "war nightmare",
      "epic immersion",
      "fever-dream cinema"
    ],
    "good_pick_if": "You want a big, intense movie night pick that feels overwhelming in the best way.",
    "maybe_skip_if": "You want clean plotting, lighter energy, or a shorter watch.",
    "confidence": "high",
    "source_quotes": [
      {
        "text": "totally immersive",
        "source": "Letterboxd review by Peter Labuza",
        "url": "https://letterboxd.com/labuzamovies/film/apocalypse-now/"
      }
    ]
  },
  {
    "slug": "incendies",
    "summary": "People describe it as \"brutal and tender,\" and that balance is the reason it hits so hard. It is a mystery-shaped drama with real emotional force, made for a room that can handle something serious and lingering.",
    "appeal_tags": [
      "harrowing mystery",
      "generational trauma",
      "serious intensity"
    ],
    "good_pick_if": "You want something gripping, emotionally heavy, and built to leave the room quiet after.",
    "maybe_skip_if": "You want comfort, gentleness, or spoilers about why this one is so upsetting.",
    "confidence": "high",
    "source_quotes": [
      {
        "text": "brutal and tender",
        "source": "Letterboxd review by august",
        "url": "https://letterboxd.com/filmvamps/film/incendies/"
      }
    ]
  },
  {
    "slug": "andrei-rublev",
    "summary": "People call it an \"epic tour de force,\" but it does not play like dry prestige homework. It is spiritual, muddy, and tactile, the kind of long movie that keeps opening into stranger and deeper feelings.",
    "appeal_tags": [
      "spiritual epic",
      "historical immersion",
      "tarkovsky scale"
    ],
    "good_pick_if": "You want a long, serious movie that feels mysterious and fully lived-in rather than academic.",
    "maybe_skip_if": "You need brisk pacing or something less demanding than a three-hour historical odyssey.",
    "confidence": "medium",
    "source_quotes": [
      {
        "text": "epic tour de force",
        "source": "Letterboxd review by Paul Elliott",
        "url": "https://letterboxd.com/goliathreturns/film/andrei-rublev/"
      }
    ]
  },
  {
    "slug": "the-passion-of-joan-of-arc",
    "summary": "The easiest pitch is Falconetti's face: people say \"you will never forget\" her eyes, and that is the whole experience. It is stripped-down, intense, and somehow more emotionally direct than most much louder dramas.",
    "appeal_tags": [
      "silent intensity",
      "iconic close-ups",
      "spiritual pressure"
    ],
    "good_pick_if": "You want a silent film that feels immediate, raw, and genuinely overwhelming.",
    "maybe_skip_if": "You want a more relaxed classic or anything less emotionally severe.",
    "confidence": "high",
    "source_quotes": [
      {
        "text": "you will never forget",
        "source": "Letterboxd review by Roger Ebert",
        "url": "https://letterboxd.com/electricebert/film/the-passion-of-joan-of-arc/"
      }
    ]
  },
  {
    "slug": "tokyo-story",
    "summary": "People describe it as \"pure humanity,\" which is exactly the appeal. It is quiet, delicate, and devastating in a very ordinary way, helping a room settle into feeling instead of waiting for big plot turns.",
    "appeal_tags": [
      "quiet heartbreak",
      "family reflection",
      "gentle realism"
    ],
    "good_pick_if": "You want something calm, tender, and emotionally piercing without melodrama.",
    "maybe_skip_if": "You need strong plot momentum or more overt stylistic fireworks.",
    "confidence": "high",
    "source_quotes": [
      {
        "text": "pure humanity",
        "source": "Letterboxd review by Julian Schierle",
        "url": "https://letterboxd.com/popcorn_guide/film/tokyo-story/"
      }
    ]
  },
  {
    "slug": "portrait-of-a-lady-on-fire",
    "summary": "People call it \"beautifully hypnotic,\" and that is the room vibe to expect. It is slow, sensual, and built almost entirely out of glances, tension, and precise visual feeling.",
    "appeal_tags": [
      "longing on screen",
      "painterly romance",
      "charged glances"
    ],
    "good_pick_if": "You want a romantic drama that is patient, intimate, and visually exact.",
    "maybe_skip_if": "You want faster pacing or a romance that is less restrained and contemplative.",
    "confidence": "high",
    "source_quotes": [
      {
        "text": "beautifully hypnotic",
        "source": "Letterboxd popular review by Karsten",
        "url": "https://letterboxd.com/film/portrait-of-a-lady-on-fire/review/"
      }
    ]
  },
  {
    "slug": "mishima-a-life-in-four-chapters",
    "summary": "The big draw is how \"boldly stylised\" it is without losing the human pull. It turns biography into something operatic, intellectual, and visually rich enough that the whole movie feels like staged obsession.",
    "appeal_tags": [
      "stylized biopic",
      "operatic structure",
      "intellectual drama"
    ],
    "good_pick_if": "You want something visually adventurous that still gives the room a lot to chew on.",
    "maybe_skip_if": "You want a simpler character study or less formally ornate filmmaking.",
    "confidence": "medium",
    "source_quotes": [
      {
        "text": "boldly stylised",
        "source": "Letterboxd review by Mark Costello",
        "url": "https://letterboxd.com/coz22998/film/mishima-a-life-in-four-chapters/"
      }
    ]
  },
  {
    "slug": "fanny-and-alexander",
    "summary": "People fixate on the \"warmth\" of the family scenes, and that warmth is what makes the rest of it land. It is rich, theatrical, spooky around the edges, and ideal for a room that wants something big and enveloping.",
    "appeal_tags": [
      "family tapestry",
      "sumptuous atmosphere",
      "bergman warmth"
    ],
    "good_pick_if": "You want a long, immersive drama that feels lush, emotional, and a little magical.",
    "maybe_skip_if": "You want a leaner movie or do not have patience for a sprawling family saga.",
    "confidence": "medium",
    "source_quotes": [
      {
        "text": "such a warmth",
        "source": "Letterboxd reviews page",
        "url": "https://letterboxd.com/film/fanny-and-alexander/reviews/"
      }
    ]
  },
  {
    "slug": "sansho-the-bailiff",
    "summary": "People call it \"heartbreaking\" and they are not overselling it. It is humane, patient, and morally bruising, the kind of drama that earns its emotion by staying calm and unsentimental.",
    "appeal_tags": [
      "moral tragedy",
      "patient devastation",
      "humanist drama"
    ],
    "good_pick_if": "You want something serious, compassionate, and emotionally wrecking in a very controlled way.",
    "maybe_skip_if": "You want relief, levity, or a movie that is easier to shake off afterward.",
    "confidence": "high",
    "source_quotes": [
      {
        "text": "Heartbreaking to watch",
        "source": "Letterboxd review by Rael",
        "url": "https://letterboxd.com/usaei/film/sansho-the-bailiff/"
      }
    ]
  }
]
