[
  {
    "slug": "wake-in-fright",
    "summary": "The joke that it is horror about \"hang out with Australians\" lands because the movie is all sweaty social pressure. It feels like being trapped in bad company until the whole world turns hostile and unreal.",
    "appeal_tags": [
      "social horror",
      "outback spiral",
      "sweaty dread"
    ],
    "good_pick_if": "you want something tense, ugly, and impossible to shake off",
    "maybe_skip_if": "you want your thrillers less abrasive or less boozy",
    "confidence": "high",
    "source_quotes": [
      {
        "text": "what if you had to hang out with Australians",
        "source": "Letterboxd review by Matthew Christman",
        "url": "https://letterboxd.com/worsethan/film/wake-in-fright/"
      }
    ]
  },
  {
    "slug": "i-saw-the-devil",
    "summary": "The \"no horns, just a hoodie\" line gets why this hits so hard. It takes revenge-thriller intensity and makes it feel modern, brutal, and sickeningly intimate instead of mythic or fun.",
    "appeal_tags": [
      "revenge nightmare",
      "brutal chase",
      "intimate terror"
    ],
    "good_pick_if": "you want an extreme thriller with real velocity and menace",
    "maybe_skip_if": "graphic cruelty or nihilism is a hard no",
    "confidence": "high",
    "source_quotes": [
      {
        "text": "He had no horns, just a hoodie.",
        "source": "Letterboxd review by YI JIAN",
        "url": "https://letterboxd.com/yijian/film/i-saw-the-devil/"
      }
    ]
  },
  {
    "slug": "let-the-right-one-in",
    "summary": "One reviewer just calls it \"one of the best love stories ever shown on film,\" and that is the real lane. The horror is great, but the deeper pull is the lonely winter tenderness underneath it.",
    "appeal_tags": [
      "frostbitten romance",
      "lonely horror",
      "humane vampire tale"
    ],
    "good_pick_if": "you want something eerie, intimate, and unexpectedly gentle",
    "maybe_skip_if": "you want your vampire movies campier or more openly pulpy",
    "confidence": "high",
    "source_quotes": [
      {
        "text": "one of the best love stories ever shown on film",
        "source": "Letterboxd review by Lucy",
        "url": "https://letterboxd.com/deathproof/film/let-the-right-one-in/1/"
      }
    ]
  },
  {
    "slug": "bound",
    "summary": "Calling it a \"stylish erotic thriller\" barely covers it. The movie is tight, sexy, funny, and so in control of its own mechanics that every switch in allegiance feels like part of the seduction.",
    "appeal_tags": [
      "queer noir",
      "erotic suspense",
      "twisty momentum"
    ],
    "good_pick_if": "you want a slick thriller with chemistry and actual confidence",
    "maybe_skip_if": "you want less pulp or less heat in your crime movies",
    "confidence": "high",
    "source_quotes": [
      {
        "text": "a stylish erotic thriller with a killer plot",
        "source": "Letterboxd review by Lucy",
        "url": "https://letterboxd.com/deathproof/film/bound/"
      }
    ]
  },
  {
    "slug": "peeping-tom",
    "summary": "The \"I bet Hitchcock wished he made this\" reaction makes sense. It is elegant, nasty, and weirdly self-aware, with a voyeuristic chill that feels both classic and ahead of its time.",
    "appeal_tags": [
      "voyeur horror",
      "formal menace",
      "psychological unease"
    ],
    "good_pick_if": "you want old-school horror with craft and real creep factor",
    "maybe_skip_if": "you want slashier thrills than slow-burn discomfort",
    "confidence": "high",
    "source_quotes": [
      {
        "text": "I bet Hitchcock wished he made this.",
        "source": "Letterboxd review by cassandra",
        "url": "https://letterboxd.com/belledejour/film/peeping-tom/"
      }
    ]
  },
  {
    "slug": "the-batman",
    "summary": "The best review angle is that this Batman finally \"looks for clues in a big stack of dusty old files.\" It leans fully into detective noir, rain-soaked grime, and brooding immersion instead of superhero quippiness.",
    "appeal_tags": [
      "detective noir",
      "gothic grime",
      "brooding immersion"
    ],
    "good_pick_if": "you want Batman as a moody mystery more than a quip machine",
    "maybe_skip_if": "you want lighter comic-book energy or tighter pacing",
    "confidence": "high",
    "source_quotes": [
      {
        "text": "finally a Batman who sits down and looks for clues in a big stack of dusty old files",
        "source": "Letterboxd review by Patrick Willems",
        "url": "https://letterboxd.com/patrickhwillems/film/the-batman/"
      }
    ]
  },
  {
    "slug": "scream",
    "summary": "That \"what’s your favourite scary movie\" line is still the hook because the movie is playful, sharp, and deeply crowd-friendly. It gets the slasher mechanics and still has fun messing with them.",
    "appeal_tags": [
      "meta slasher",
      "teen panic",
      "crowd-pleaser suspense"
    ],
    "good_pick_if": "you want horror that is tense, funny, and easy to watch with friends",
    "maybe_skip_if": "you want your slashers played completely straight",
    "confidence": "high",
    "source_quotes": [
      {
        "text": "what’s your favourite scary movie",
        "source": "Letterboxd review by •lily•",
        "url": "https://letterboxd.com/sapphicquinn/film/scream/"
      }
    ]
  },
  {
    "slug": "zodiac",
    "summary": "People quote \"not many people have basements in California\" because the movie makes ordinary details feel catastrophic. It is procedural obsession turned into dread, with tension that just keeps quietly tightening.",
    "appeal_tags": [
      "procedural dread",
      "obsessive investigation",
      "Fincher chill"
    ],
    "good_pick_if": "you want a meticulous thriller that earns every shiver",
    "maybe_skip_if": "you want closure, speed, or emotional relief",
    "confidence": "high",
    "source_quotes": [
      {
        "text": "not many people have basements in california",
        "source": "Letterboxd review by cait",
        "url": "https://letterboxd.com/shutterisland/film/zodiac/5/"
      }
    ]
  },
  {
    "slug": "the-american-friend",
    "summary": "One smart description calls it \"an existential play disguised as a thriller,\" which is why people lock into it. The movie moves like noir, but the real appeal is the mood, drift, and uneasy male chemistry.",
    "appeal_tags": [
      "existential noir",
      "moody drift",
      "uneasy intimacy"
    ],
    "good_pick_if": "you want a thriller that cares more about atmosphere than payoff",
    "maybe_skip_if": "you want cleaner plotting or faster suspense beats",
    "confidence": "medium",
    "source_quotes": [
      {
        "text": "an existential play disguised as a thriller",
        "source": "Letterboxd review by Nakul",
        "url": "https://letterboxd.com/itsnacool/film/the-american-friend/"
      }
    ]
  },
  {
    "slug": "bound-by-honor",
    "summary": "Calling it an \"epic, memorable, violent, engrossing\" saga is about right. It is big-hearted and bruising at once, with family loyalty and neighborhood identity giving the whole crime story real weight.",
    "appeal_tags": [
      "street-saga sprawl",
      "brotherhood drama",
      "gangland gravity"
    ],
    "good_pick_if": "you want a long crime story powered by loyalty and cultural texture",
    "maybe_skip_if": "you want something leaner or less melodramatic",
    "confidence": "medium",
    "source_quotes": [
      {
        "text": "An epic, memorable, violent, engrossing and delightfully goofy crime saga",
        "source": "Letterboxd review by Christian Di Leo",
        "url": "https://letterboxd.com/dileho/film/bound-by-honor/"
      }
    ]
  }
]
