[
  {
    "slug": "amour",
    "summary": "The reaction that it is \"devastating and honestly hard to watch\" is basically the warning label and the sell. What people respond to is how unsentimental and deeply loving it feels at the same time.",
    "appeal_tags": [
      "elder-love ache",
      "intimate devastation",
      "unsparing tenderness"
    ],
    "good_pick_if": "you want a serious drama that treats love as care, not fantasy",
    "maybe_skip_if": "you are not in the mood for something emotionally brutal",
    "confidence": "high",
    "source_quotes": [
      {
        "text": "Devastating and honestly hard to watch.",
        "source": "Letterboxd review by kayla",
        "url": "https://letterboxd.com/kfavs/film/amour/"
      }
    ]
  },
  {
    "slug": "dreams",
    "summary": "The best pitch is just \"here's some dreams I had.\" That simplicity lets the movie feel loose, personal, and visually bottomless, like Kurosawa inviting you directly into his own subconscious.",
    "appeal_tags": [
      "dream-vignette wonder",
      "visual meditation",
      "Kurosawa reverie"
    ],
    "good_pick_if": "you want a poetic movie that works by image and feeling",
    "maybe_skip_if": "you want one tidy plot instead of drifting episodes",
    "confidence": "high",
    "source_quotes": [
      {
        "text": "here's some dreams I had",
        "source": "Letterboxd review by David Sims",
        "url": "https://letterboxd.com/davidlsims/film/dreams/"
      }
    ]
  },
  {
    "slug": "the-white-ribbon",
    "summary": "One review says it asks \"where does evil come from,\" and that is the movie’s cold fascination. It is austere, unsettling, and so controlled that the atmosphere becomes its own form of accusation.",
    "appeal_tags": [
      "moral dread",
      "austere mystery",
      "Haneke chill"
    ],
    "good_pick_if": "you want a serious drama that burrows under your skin slowly",
    "maybe_skip_if": "you want warmth, release, or easy interpretation",
    "confidence": "high",
    "source_quotes": [
      {
        "text": "where does evil come from?",
        "source": "Letterboxd review by Darren Carver-Balsiger",
        "url": "https://letterboxd.com/darrencb/film/the-white-ribbon/"
      }
    ]
  },
  {
    "slug": "the-turin-horse",
    "summary": "Calling it \"a film of the elements\" gets at how physical it feels. Wind, labor, repetition, and exhaustion become the whole experience, and the movie turns that severity into something strangely hypnotic.",
    "appeal_tags": [
      "elemental severity",
      "apocalypse minimalism",
      "hypnotic repetition"
    ],
    "good_pick_if": "you want cinema pared down to mood, matter, and endurance",
    "maybe_skip_if": "you need pace or plot to stay engaged",
    "confidence": "high",
    "source_quotes": [
      {
        "text": "This is a film of the elements.",
        "source": "Letterboxd review by Sally Jane Black",
        "url": "https://letterboxd.com/fuchsiadyke/film/the-turin-horse/"
      }
    ]
  },
  {
    "slug": "to-live",
    "summary": "The line \"people will continue to adapt\" gets at why this lands so deeply. It is sweeping without losing the human scale, and it finds resilience in ordinary life without pretending history is kind.",
    "appeal_tags": [
      "historical resilience",
      "family endurance",
      "sweeping humanity"
    ],
    "good_pick_if": "you want a big life-spanning drama that stays human-sized",
    "maybe_skip_if": "you want history without loss or hardship in it",
    "confidence": "high",
    "source_quotes": [
      {
        "text": "people will continue to adapt",
        "source": "Letterboxd review by Josh Lewis",
        "url": "https://letterboxd.com/thejoshl/film/to-live/"
      }
    ]
  },
  {
    "slug": "make-way-for-tomorrow",
    "summary": "\"Aging is devastating\" is blunt, but accurate. The movie hurts because it is so gentle and observant about everyday indignity, and because its sadness comes from ordinary family failure rather than melodramatic tricks.",
    "appeal_tags": [
      "aging sorrow",
      "domestic heartbreak",
      "gentle devastation"
    ],
    "good_pick_if": "you want a classic that earns tears honestly",
    "maybe_skip_if": "you want emotional protection tonight",
    "confidence": "high",
    "source_quotes": [
      {
        "text": "Aging is devastating.",
        "source": "Letterboxd review by Ethan Colburn",
        "url": "https://letterboxd.com/cineflek/film/make-way-for-tomorrow/"
      }
    ]
  },
  {
    "slug": "war-and-peace-part-iv-pierre-bezukhov",
    "summary": "That idea of \"a final breath from something huge\" is the right frame. This last stretch feels reflective and spent in a good way, like the movie finally exhaling after all the scale and upheaval.",
    "appeal_tags": [
      "epic exhale",
      "historical vastness",
      "reflective grandeur"
    ],
    "good_pick_if": "you want a finale that feels weighty, intimate, and enormous at once",
    "maybe_skip_if": "you want your historical epics to stay punchier to the end",
    "confidence": "medium",
    "source_quotes": [
      {
        "text": "a final breath from something huge",
        "source": "Letterboxd review by noen",
        "url": "https://letterboxd.com/menslaughter/film/war-and-peace-part-iv-pierre-bezukhov/"
      }
    ]
  },
  {
    "slug": "trainspotting",
    "summary": "\"The Boy And The Heroin\" is a joke, but the movie’s real appeal is its manic style. It is gross, funny, frantic, and weirdly alive in a way that keeps the whole spiral from turning inert.",
    "appeal_tags": [
      "chemical chaos",
      "punk propulsion",
      "blackly funny"
    ],
    "good_pick_if": "you want something feral, stylish, and very hard to ignore",
    "maybe_skip_if": "you want addiction stories handled with more calm distance",
    "confidence": "high",
    "source_quotes": [
      {
        "text": "The Boy And The Heroin",
        "source": "Letterboxd review by Framesofnick",
        "url": "https://letterboxd.com/framesofnick/film/trainspotting/"
      }
    ]
  },
  {
    "slug": "raging-bull",
    "summary": "That note about the look in Jake’s eyes when he thinks he has somebody \"cornered\" is exactly what makes this so gripping. It is less a sports movie than a study in corrosive masculinity and self-destruction.",
    "appeal_tags": [
      "self-destruction study",
      "boxing brutality",
      "masculine rot"
    ],
    "good_pick_if": "you want something formally masterful and emotionally punishing",
    "maybe_skip_if": "you need a protagonist worth rooting for",
    "confidence": "high",
    "source_quotes": [
      {
        "text": "that look in his eyes when he thinks he has somebody cornered",
        "source": "Letterboxd review by Rida",
        "url": "https://letterboxd.com/sufiyana/film/raging-bull/"
      }
    ]
  },
  {
    "slug": "dancer-in-the-dark",
    "summary": "The line \"It’s just so quiet here\" gets at the ache of this movie better than a grand speech would. It is emotionally overwhelming, stylized in strange ways, and built to break your heart completely.",
    "appeal_tags": [
      "musical despair",
      "heartbreak overload",
      "Björk intensity"
    ],
    "good_pick_if": "you want a movie that commits fully to devastation and feeling",
    "maybe_skip_if": "emotional manipulation is a dealbreaker for you",
    "confidence": "medium",
    "source_quotes": [
      {
        "text": "It's just so quiet here.",
        "source": "Letterboxd review by Eli Hayes",
        "url": "https://letterboxd.com/elihayes/film/dancer-in-the-dark/1/"
      }
    ]
  }
]
