[
  {
    "slug": "whats-up-doc-1972",
    "summary": "People call it \"pure screwball chaos,\" and that is exactly the fun: immaculate comic timing, runaway momentum, and a movie that keeps topping its own joke.",
    "appeal_tags": [
      "screwball chase energy",
      "rapid fire gags",
      "old school chaos"
    ],
    "good_pick_if": "you want a fast, friendly comedy that keeps a room laughing",
    "maybe_skip_if": "you want something dry, subtle, or less manic",
    "confidence": "high",
    "source_quotes": [
      {
        "text": "pure screwball chaos",
        "source": "Letterboxd reviews page",
        "url": "https://letterboxd.com/film/whats-up-doc-1972/reviews/"
      }
    ]
  },
  {
    "slug": "death-by-hanging",
    "summary": "People describe it as \"bleak and absurd,\" which gets at the appeal: a political satire that stays formally sharp, funny in a dangerous way, and hard to shake.",
    "appeal_tags": [
      "political absurdism",
      "moral unease",
      "formal audacity"
    ],
    "good_pick_if": "you want something challenging, satirical, and conversation-heavy afterward",
    "maybe_skip_if": "you want an easy hang or gentle comedy",
    "confidence": "medium",
    "source_quotes": [
      {
        "text": "bleak and absurd",
        "source": "Letterboxd reviews page",
        "url": "https://letterboxd.com/film/death-by-hanging/reviews/"
      }
    ]
  },
  {
    "slug": "another-round",
    "summary": "People keep calling it \"funny until it isn't,\" and that balance is the sell: loose hangout energy, bruised midlife feeling, and performances that keep it human.",
    "appeal_tags": [
      "midlife hangout drama",
      "bittersweet looseness",
      "ensemble charisma"
    ],
    "good_pick_if": "you want something lively, adult, and a little messy in a good way",
    "maybe_skip_if": "you want broad comedy or clean moral lessons",
    "confidence": "high",
    "source_quotes": [
      {
        "text": "funny until it isn't",
        "source": "Letterboxd reviews page",
        "url": "https://letterboxd.com/film/another-round/reviews/"
      }
    ]
  },
  {
    "slug": "the-graduate",
    "summary": "People call it \"awkward in the best way,\" and the movie still lands because the comedy, discomfort, and drifting post-college mood all stay perfectly in tune.",
    "appeal_tags": [
      "awkward satire",
      "youthful drift",
      "sharp seventies wit"
    ],
    "good_pick_if": "you want a classic that feels funny, stylish, and a little alienated",
    "maybe_skip_if": "you want romance without cringe or generational bite",
    "confidence": "high",
    "source_quotes": [
      {
        "text": "awkward in the best way",
        "source": "Letterboxd reviews page",
        "url": "https://letterboxd.com/film/the-graduate/reviews/"
      }
    ]
  },
  {
    "slug": "adaptation",
    "summary": "People call it \"a brain spiral,\" and that is the draw: anxious, funny, self-lacerating, and somehow still warm enough to hang onto.",
    "appeal_tags": [
      "meta panic comedy",
      "writer brain chaos",
      "neurotic warmth"
    ],
    "good_pick_if": "you want something strange, funny, and unusually personal",
    "maybe_skip_if": "you want a neat premise that stays neat",
    "confidence": "high",
    "source_quotes": [
      {
        "text": "a brain spiral",
        "source": "Letterboxd reviews page",
        "url": "https://letterboxd.com/film/adaptation/reviews/"
      }
    ]
  },
  {
    "slug": "a-summers-tale",
    "summary": "People describe it as \"so breezy and specific,\" and that is the whole charm: conversational romance, seaside lightness, and tiny emotional shifts that feel huge.",
    "appeal_tags": [
      "summer drift romance",
      "talky seaside charm",
      "Rohmer lightness"
    ],
    "good_pick_if": "you want a low-stakes romance with smart, relaxed conversation",
    "maybe_skip_if": "you want louder chemistry or a stronger plot engine",
    "confidence": "medium",
    "source_quotes": [
      {
        "text": "so breezy and specific",
        "source": "Letterboxd reviews page",
        "url": "https://letterboxd.com/film/a-summers-tale/reviews/"
      }
    ]
  },
  {
    "slug": "no-other-choice-2025",
    "summary": "People call it \"mean in a thrilling way,\" and the pull is that it turns humiliation, desperation, and dark comedy into something nervy and uncomfortably alive.",
    "appeal_tags": [
      "dark workplace panic",
      "nervy satire",
      "escalating desperation"
    ],
    "good_pick_if": "you want a sharp thriller with black-comic cruelty",
    "maybe_skip_if": "you want something gentle or morally reassuring",
    "confidence": "medium",
    "source_quotes": [
      {
        "text": "mean in a thrilling way",
        "source": "Letterboxd reviews page",
        "url": "https://letterboxd.com/film/no-other-choice-2025/reviews/"
      }
    ]
  },
  {
    "slug": "the-worst-person-in-the-world",
    "summary": "People keep saying it feels \"painfully recognizable,\" and that is why it works so well: restless romantic energy, big feelings, and a very current sense of drift.",
    "appeal_tags": [
      "romantic restlessness",
      "twentysomething ache",
      "lively introspection"
    ],
    "good_pick_if": "you want something funny, modern, and emotionally exposed",
    "maybe_skip_if": "you want a cleaner protagonist arc or less self-scrutiny",
    "confidence": "high",
    "source_quotes": [
      {
        "text": "painfully recognizable",
        "source": "Letterboxd reviews page",
        "url": "https://letterboxd.com/film/the-worst-person-in-the-world/reviews/"
      }
    ]
  },
  {
    "slug": "hunt-for-the-wilderpeople",
    "summary": "People call it \"sweet without getting mushy,\" which is pretty much the pitch. It is funny, scrappy, and built around chemistry that gets warmer as it goes.",
    "appeal_tags": [
      "odd couple warmth",
      "adventure comedy heart",
      "scrappy charm"
    ],
    "good_pick_if": "you want a crowd-friendly comedy with real heart",
    "maybe_skip_if": "you want something edgier or less openly sentimental",
    "confidence": "high",
    "source_quotes": [
      {
        "text": "sweet without getting mushy",
        "source": "Letterboxd reviews page",
        "url": "https://letterboxd.com/film/hunt-for-the-wilderpeople/reviews/"
      }
    ]
  },
  {
    "slug": "kneecap",
    "summary": "People call it \"chaotic as hell,\" and the movie earns that as a compliment: rowdy music-comedy energy, real attitude, and a rebellious streak that feels contagious.",
    "appeal_tags": [
      "rowdy music comedy",
      "language pride swagger",
      "punk room energy"
    ],
    "good_pick_if": "you want something loud, funny, and very alive",
    "maybe_skip_if": "you want polished respectability or softer edges",
    "confidence": "high",
    "source_quotes": [
      {
        "text": "chaotic as hell",
        "source": "Letterboxd reviews page",
        "url": "https://letterboxd.com/film/kneecap/reviews/"
      }
    ]
  }
]
