[
  {
    "slug": "whisper-of-the-heart",
    "summary": "People call it a \"simple yet genuine love story,\" which is the cleanest reason to pick it. It is tender, observant, and quietly romantic, built for a watch that wants softness without feeling bland.",
    "appeal_tags": [
      "gentle romance",
      "quiet coming-of-age",
      "soft sincerity"
    ],
    "good_pick_if": "You want a calm, heartfelt movie that never tries too hard.",
    "maybe_skip_if": "You want big swings, loud comedy, or high drama.",
    "confidence": "high",
    "source_quotes": [
      {
        "text": "simple yet genuine love story",
        "source": "Letterboxd reviews page",
        "url": "https://letterboxd.com/film/whisper-of-the-heart/reviews/"
      }
    ]
  },
  {
    "slug": "mulan",
    "summary": "The strongest sell is that \"all she wanted was to prove herself,\" which is exactly the kind of drive the movie rewards. It is spirited, funny, and built around a lead who makes the whole adventure feel earned.",
    "appeal_tags": [
      "heroic self-proof",
      "animated adventure",
      "earnest energy"
    ],
    "good_pick_if": "You want a spirited underdog story with action and heart.",
    "maybe_skip_if": "You want a slower, less eventful, or more adult drama.",
    "confidence": "high",
    "source_quotes": [
      {
        "text": "all she wanted was to prove herself",
        "source": "Letterboxd reviews page",
        "url": "https://letterboxd.com/film/mulan/reviews/"
      }
    ]
  },
  {
    "slug": "a-close-shave-1995",
    "summary": "The pitch is \"goofy shenanigans,\" and that is exactly the kind of energy it runs on. It is playful, clever, and full of visual invention, with jokes that keep landing even when the setup gets wonderfully absurd.",
    "appeal_tags": [
      "stop-motion comedy",
      "playful invention",
      "goofy timing"
    ],
    "good_pick_if": "You want something breezy, funny, and handmade with real craft.",
    "maybe_skip_if": "You want seriousness or a movie that stays emotionally restrained.",
    "confidence": "high",
    "source_quotes": [
      {
        "text": "goofy shenanigans",
        "source": "Letterboxd reviews page",
        "url": "https://letterboxd.com/film/a-close-shave-1995/reviews/"
      }
    ]
  },
  {
    "slug": "the-wolf-house",
    "summary": "People respond to its \"great eerie vibe,\" and that is the right warning label for the experience. It is eerie, handmade-feeling, and unsettling in a way that rewards attention more than explanation.",
    "appeal_tags": [
      "eerie atmosphere",
      "surreal horror",
      "handmade unease"
    ],
    "good_pick_if": "You want something spooky, artful, and unlike standard horror.",
    "maybe_skip_if": "You want clarity, comfort, or a straightforward scare machine.",
    "confidence": "medium",
    "source_quotes": [
      {
        "text": "great eerie vibe",
        "source": "Letterboxd reviews page",
        "url": "https://letterboxd.com/film/the-wolf-house/reviews/"
      }
    ]
  },
  {
    "slug": "how-to-train-your-dragon",
    "summary": "The easy hook is \"beautiful, funny, nostalgic,\" and that is still the best summary of its appeal. It is big-hearted, funny, and emotionally smooth in a way that makes it easy to recommend to almost anyone.",
    "appeal_tags": [
      "family adventure",
      "nostalgic wonder",
      "big-hearted fun"
    ],
    "good_pick_if": "You want an uplifting adventure that works for kids and adults.",
    "maybe_skip_if": "You want something edgy, grim, or less openly sentimental.",
    "confidence": "high",
    "source_quotes": [
      {
        "text": "beautiful, funny, nostalgic",
        "source": "Letterboxd reviews page",
        "url": "https://letterboxd.com/film/how-to-train-your-dragon/reviews/"
      }
    ]
  },
  {
    "slug": "kikis-delivery-service",
    "summary": "People describe it as \"lovely and sweet and calm,\" which is basically the whole invitation. It is warm, breezy, and restorative, the kind of movie that makes a night feel a little lighter without demanding much.",
    "appeal_tags": [
      "gentle comfort",
      "calm magic",
      "cozy independence"
    ],
    "good_pick_if": "You want something soothing, kind, and easy to settle into.",
    "maybe_skip_if": "You want conflict, intensity, or a plot with bigger spikes.",
    "confidence": "high",
    "source_quotes": [
      {
        "text": "lovely and sweet and calm",
        "source": "Letterboxd reviews page",
        "url": "https://letterboxd.com/film/kikis-delivery-service/reviews/"
      }
    ]
  },
  {
    "slug": "rabbit-fire",
    "summary": "The appeal is that it feels \"timeless and funny\" without needing any extra explanation. It is brisk, elastic, and built on jokes that still move cleanly because the comic rhythm is so locked in.",
    "appeal_tags": [
      "classic cartoon",
      "timeless comedy",
      "sharp timing"
    ],
    "good_pick_if": "You want a short, fast, reliably funny watch with no filler.",
    "maybe_skip_if": "You want something modern, layered, or emotionally weighty.",
    "confidence": "high",
    "source_quotes": [
      {
        "text": "timeless and funny",
        "source": "Letterboxd review by Justin Peterson",
        "url": "https://letterboxd.com/justin_peterson/film/rabbit-fire/"
      }
    ]
  },
  {
    "slug": "coco-2017",
    "summary": "The clearest pitch is that it has \"a special place in my heart,\" and the movie earns that kind of feeling. It is colorful, affectionate, and emotionally direct, with enough warmth to work even if you are not usually sentimental.",
    "appeal_tags": [
      "family remembrance",
      "colorful heart",
      "musical warmth"
    ],
    "good_pick_if": "You want something moving, accessible, and easy to share with a group.",
    "maybe_skip_if": "You want a cooler, more detached, or less emotional pick.",
    "confidence": "high",
    "source_quotes": [
      {
        "text": "a special place in my heart",
        "source": "Letterboxd reviews page",
        "url": "https://letterboxd.com/film/coco-2017/reviews/"
      }
    ]
  },
  {
    "slug": "puss-in-boots-the-last-wish",
    "summary": "People love that \"every single joke in this movie land,\" and that is the core promise. It is kinetic, cheeky, and much smarter on its feet than a sequel this playful has any right to be.",
    "appeal_tags": [
      "fast sequel",
      "comedy momentum",
      "animated swagger"
    ],
    "good_pick_if": "You want a joke-dense adventure that keeps moving and stays fun.",
    "maybe_skip_if": "You want a slower pace or a more serious animated story.",
    "confidence": "high",
    "source_quotes": [
      {
        "text": "every single joke in this movie land",
        "source": "Letterboxd reviews page",
        "url": "https://letterboxd.com/film/puss-in-boots-the-last-wish/reviews/"
      }
    ]
  },
  {
    "slug": "paddington-2",
    "summary": "The best shorthand is that it can \"reset the mind and heart,\" and that is not an exaggeration. It is warm, nimble, and disarmingly kind, with enough comic precision to feel fresh even on repeat viewing.",
    "appeal_tags": [
      "feel-good charm",
      "kind comedy",
      "repeatable comfort"
    ],
    "good_pick_if": "You want a movie that is funny, sweet, and reliably restorative.",
    "maybe_skip_if": "You want cynicism, edge, or a movie that fights back harder.",
    "confidence": "high",
    "source_quotes": [
      {
        "text": "reset the mind and heart",
        "source": "Letterboxd reviews page",
        "url": "https://letterboxd.com/film/paddington-2/reviews/"
      }
    ]
  }
]
