[
  {
    "slug": "the-spook-who-sat-by-the-door",
    "summary": "The strongest review frame is that the movie is powerful because of its \"dedication to the politics behind its revolution.\" It is tense genre filmmaking, but it is also fiercely clear-eyed about strategy and power.",
    "appeal_tags": [
      "radical politics",
      "strategic suspense",
      "revolutionary charge"
    ],
    "good_pick_if": "you want a political thriller with real ideological bite",
    "maybe_skip_if": "you want the movie to soften or dilute its anger",
    "confidence": "high",
    "source_quotes": [
      {
        "text": "its dedication to the politics behind its revolution",
        "source": "Letterboxd review by Liz",
        "url": "https://letterboxd.com/schlockvalue/film/the-spook-who-sat-by-the-door/1/"
      }
    ]
  },
  {
    "slug": "her",
    "summary": "The best sincere review take is that it feels like a \"big warm blanket\" when you are down. The movie is melancholy and futuristic, but its real appeal is how gently it handles loneliness and longing.",
    "appeal_tags": [
      "soft loneliness",
      "future melancholy",
      "warm-hearted sci-fi"
    ],
    "good_pick_if": "you want something tender, thoughtful, and a little wistful",
    "maybe_skip_if": "tech-romance as a premise just does not work for you",
    "confidence": "high",
    "source_quotes": [
      {
        "text": "it takes a big warm blanket and wraps it around you",
        "source": "Letterboxd review by Karsten",
        "url": "https://letterboxd.com/kurstboy/film/her/1/"
      }
    ]
  },
  {
    "slug": "top-gun-maverick",
    "summary": "The good review line here is that the flying is amazing, but the bigger surprise is that Cruise finally made a movie that \"acknowledges his age.\" That gives all the blockbuster craft some real feeling underneath it.",
    "appeal_tags": [
      "practical spectacle",
      "legacy adrenaline",
      "earned swagger"
    ],
    "good_pick_if": "you want a huge crowd-pleaser that actually sticks the landing",
    "maybe_skip_if": "you want less military mythmaking in your action movies",
    "confidence": "high",
    "source_quotes": [
      {
        "text": "Tom Cruise finally made a movie that acknowledges his age",
        "source": "Letterboxd review by Patrick Willems",
        "url": "https://letterboxd.com/patrickhwillems/film/top-gun-maverick/"
      }
    ]
  },
  {
    "slug": "guardians-of-the-galaxy-vol-3",
    "summary": "Calling it an \"apology letter from marvel studios\" is a funny way to say it has more feeling and personality than people expected. It is loud and goofy, but it actually lets the hurt matter.",
    "appeal_tags": [
      "team-family payoff",
      "goofy sorrow",
      "superhero sincerity"
    ],
    "good_pick_if": "you want a blockbuster that remembers to have a heart",
    "maybe_skip_if": "you are fully burned out on Marvel no matter what",
    "confidence": "medium",
    "source_quotes": [
      {
        "text": "this is a fucking apology letter from marvel studios",
        "source": "Letterboxd review by ram<3",
        "url": "https://letterboxd.com/itsrambb/film/guardians-of-the-galaxy-vol-3/"
      }
    ]
  },
  {
    "slug": "ex-machina-2015",
    "summary": "One sharp read says it belongs in the category of AI stories about \"how threatened men feel by the women around them.\" That lens fits: it is sleek, tense, and much more cutting than its polished surface first suggests.",
    "appeal_tags": [
      "sleek unease",
      "gendered paranoia",
      "glass-box tension"
    ],
    "good_pick_if": "you want cerebral sci-fi with a real undercurrent of menace",
    "maybe_skip_if": "you want your AI stories less icy and more hopeful",
    "confidence": "high",
    "source_quotes": [
      {
        "text": "AI stories that are really about how threatened men feel by the women around them",
        "source": "Letterboxd review by davidehrlich",
        "url": "https://letterboxd.com/davidehrlich/film/ex-machina-2015/"
      }
    ]
  },
  {
    "slug": "a-trip-to-the-moon",
    "summary": "The observation that in the first alien movie \"it’s the humans that invade the aliens\" is part of why this still charms. It is playful, inventive, and so foundational that its handmade magic still feels fresh.",
    "appeal_tags": [
      "early-cinema wonder",
      "handmade fantasy",
      "playful invention"
    ],
    "good_pick_if": "you want a tiny piece of movie history that still feels alive",
    "maybe_skip_if": "silent-era theatricality does not connect for you",
    "confidence": "high",
    "source_quotes": [
      {
        "text": "it's the humans that invade the aliens",
        "source": "Letterboxd review by Foggy Pebble",
        "url": "https://letterboxd.com/foggypebble/film/a-trip-to-the-moon/"
      }
    ]
  },
  {
    "slug": "true-romance",
    "summary": "The review calling Brad Pitt asking the mafia if they want a hit \"truly poetic cinema\" gets the movie’s whole wavelength. It is violent, romantic, goofy, and powered by a very specific kind of delirious cool.",
    "appeal_tags": [
      "crime-pop romance",
      "delirious cool",
      "Tarantino-adjacent swagger"
    ],
    "good_pick_if": "you want something wild, quotable, and unapologetically heightened",
    "maybe_skip_if": "you want less violence and less nineties attitude",
    "confidence": "medium",
    "source_quotes": [
      {
        "text": "truly poetic cinema",
        "source": "Letterboxd review by aaron",
        "url": "https://letterboxd.com/aarnwlsn/film/true-romance/"
      }
    ]
  },
  {
    "slug": "dawn-of-the-dead",
    "summary": "The line \"slow zombies are superior in every way\" points at why this still rules. It is less about shock than watching a whole broken system shamble forward, with the mall setting turning consumer comfort into a trap.",
    "appeal_tags": [
      "mall apocalypse",
      "slow-zombie dread",
      "satirical horror"
    ],
    "good_pick_if": "you want zombie horror with brains, atmosphere, and bite",
    "maybe_skip_if": "you prefer speedier, more modern horror rhythms",
    "confidence": "high",
    "source_quotes": [
      {
        "text": "Slow zombies are superior in every way",
        "source": "Letterboxd review by Joe A",
        "url": "https://letterboxd.com/jaragon23/film/dawn-of-the-dead/"
      }
    ]
  },
  {
    "slug": "bride-of-frankenstein",
    "summary": "The \"We belong dead\" quote is one reason people never shut up about this movie. It is elegant, strange, funny, and surprisingly moving for something that still works perfectly as monster-movie iconography.",
    "appeal_tags": [
      "gothic elegance",
      "monster melancholy",
      "queer-coded weirdness"
    ],
    "good_pick_if": "you want an old horror movie with personality and pathos",
    "maybe_skip_if": "you want more full-bore terror than eerie charm",
    "confidence": "high",
    "source_quotes": [
      {
        "text": "We belong dead.",
        "source": "Letterboxd review by Josh Lewis",
        "url": "https://letterboxd.com/thejoshl/film/bride-of-frankenstein/"
      }
    ]
  },
  {
    "slug": "bring-me-the-head-of-alfredo-garcia",
    "summary": "That line about there being \"nothing sacred\" about the man in the ground tells you how scorched this movie is. It is grubby, fatalistic, and weirdly soulful beneath all the damage.",
    "appeal_tags": [
      "dusty fatalism",
      "roadside despair",
      "Peckinpah grime"
    ],
    "good_pick_if": "you want a revenge-ish crime movie that feels spiritually wrecked",
    "maybe_skip_if": "you want redemption or polish instead of damage",
    "confidence": "high",
    "source_quotes": [
      {
        "text": "There ain't nothing sacred about a hole in the ground",
        "source": "Letterboxd review by Josh Lewis",
        "url": "https://letterboxd.com/thejoshl/film/bring-me-the-head-of-alfredo-garcia/"
      }
    ]
  }
]
